job_title,company,job_location,post_date,salary,job_url,job_description
Lead Data Engineer,Eaton Corporation,"Houston, TX",,"$101,250 - $148,500 a year",https://www.indeed.com/rc/clk?jk=f04bf35868378a85&fccid=87f38351bd29de24&vjs=3,"Eaton’s Corporate Sector division is currently seeking a Lead Data Engineer. 
The expected annual salary range for this role is $101250.0 - $148500.0 a year.
 Please note the salary information shown above is a general guideline only. Salaries are based upon candidate skills, experience, and qualifications, as well as market and business considerations.



 What you’ll do:



      At Eaton we are modernizing the way we use data to accelerate our digital transformation. Join our Information Technology team and help positively impact our business through leading technologies, exciting and challenging enterprise projects, and new platforms. We are transforming to a product centric organization utilizing agile practices to help us work more incrementally and fluidly, allowing us to respond more quickly to changing business needs.
      In this role, you will be instrumental in implementing the enterprise data strategy for the data mesh architecture as part of the Chief Data Management office. You will be the subject matter expert on integration platforms that support movement of data across the enterprise, commercial and IoT sources and drive automation of both platform and integration governance. You will lead research into exploring and enabling the right toolset for the Hybrid integration platform and enabling democratized agile integration across the organization. You will also enable the team to rapidly experiment and iterate on strategies, helping drive critical decisions on how we shape the product and services provided by integration services.
      Making what matters work at Eaton takes the passion of every employee around the world. We create an environment where creativity, invention and discovery become reality, each and every day. It’s where bold, bright professionals like you can reach your full potential—and where you can help us reach ours.""
     

Create robust and automated data pipelines using traditional and modern data integration technologies, including ETL/ELT, data replication/CDC, streaming, message-oriented data movement and API-based data acquisition leveraging cloud native tool-set.
Implement orchestration of data pipelines to support migration of on-premise data platforms to cloud
Define and implement data integration patterns and solutions using standard modeling practices
Design, implement and maintain platform solutions that are reliable and scalable and focused on driving automation and improving productivity
Drive development and adoption of self-service capabilities and champion as an enabler for adopters of the platform. Assist with operationalizing citizen developer personas
Create templates to improve productivity, define standards to enforce consistency and governance. Implement dataops.
Ensure availability and stability of integration platforms and provide operational support for releases and maintenance. Adhere to operational SLAs and KPIs.
Establish end to end continuous integration and deployment and guide the team on best practices
Simplify the tooling landscape to sunset legacy applications while minimizing business disruption.






 Qualifications:


 Basic Qualifications:

Bachelor's degree in STEM from accredited university
6+ years of data engineering experience focusing on modern data management practices and contemporary toolsets
No relocation is offered for this position. All candidates must currently reside within 50 miles of an Eaton Facility to be considered. 
Must be authorized to work in the United States without company sponsorship now or in the future
This position requires use of information or access to hardware which is subject to the International Traffic in Arms Regulations (ITAR). All applicants must be U.S. persons within the meaning of ITAR. ITAR defines a U.S. person as a U.S. Citizen, U.S. Permanent Resident (i.e. 'Green Card Holder'), Political Asylee, or Refugee.


 Preferred Qualifications:

Experience in creating data pipelines using traditional and modern data integration technologies, including ETL/ELT, data replication/CDC, streaming, message-oriented data movement and API-based data acquisition leveraging cloud native tool-set.





 Skills:



Demonstrated experience with data replication/CDC tools such as HVR/FiveTran, Qlik Replicate, Golden Gate etc
Experience with cloud integration tools such as Azure Data Factory, Informatica Data Management Cloud, Amazon Glue
Demonstrated experience in implementing data pipelines using dbt Cloud/CLI, Airflow or similar workflow orchestration tools
Strong experience working with integrating large heterogeneous datasets using modern cloud integration technologies such as Azure
Strong proficiency with SQL, and using Python for data transformation.
Moderate experience working with open-source or commercial message queuing technologies, such as Azure Service Bus, Apache Nifi, Apache Kafka, etc.
Strong understanding of cloud-based data solutions such as Azure BLOB or ADLS and Synapse, AWS S3, EMR and Redshift, Databricks, Snowflake, etc. ""
Ability to lead as the subject matter expertise in the space through diagnosing, isolating, and resolving complex issues and recommending and implementing strategies to resolve problems
Ability to adapt to the situation and pivot based on changing priorities
Curious and solution oriented, ability to handle problems, work outside the comfort zone
Collaborate with the team and be open minded to ideas
Ability to identify operational issues and proactively solutions to resolve problems.
Experience acheiving platform KPIs and defining measurement targets
Ability to drive application modernization and enablement
Experience in independently driving high-level technical delivery.
Experience influencing leadership and key stakeholders on technology solutions.
Experience applying knowledge of the new processes and concepts in day to day work deliveries
Experience establishing & maintaining relationships with individuals at senior levels




 We are committed to ensuring equal employment opportunities for all job applicants and employees. Employment decisions are based upon job-related reasons regardless of an applicant's race, color, religion, sex, sexual orientation, gender identity, age, national origin, disability, marital status, genetic information, protected veteran status, or any other status protected by law.
 Eaton considers qualified applicants regardless of criminal histories, consistent with local laws. To request a disability-related reasonable accommodation to assist you in your job search, application or interview process, please call us at 1-800-836-6345 to discuss your specific need. Only accommodation requests will be accepted by this phone number.
 We know that good benefit programs are important to employees and their families. Eaton provides various Health and Welfare benefits as well as Retirement benefits, and several programs that provide for paid and unpaid time away from work. Click here for more detail: Eaton Benefits Overview. Please note that specific programs and options available to an employee may depend on eligibility factors such as geographic location, date of hire, and the applicability of collective bargaining agreements."
Lead Data Engineer,NRG,"Houston, TX 77002 (Downtown area)",,"$99,000 - $144,000 a year",https://www.indeed.com/rc/clk?jk=4c35da77abf5b4ba&fccid=ba62ec521e3e5609&vjs=3,"At NRG, we’re bringing the power of energy to people and organizations by putting customers at the center of everything we do. We generate electricity and provide energy solutions and natural gas to millions of customers through our diverse portfolio of retail brands. A Fortune 500 company, operating in the United States and Canada, NRG delivers innovative solutions while advocating for competitive energy markets and customer choice, working towards a sustainable energy future. More information is available at www.nrg.com. Connect with NRG on Facebook, LinkedIn and follow us on Twitter @nrgenergy.
 Responsibilities

 Lead Analytics Data Manage team and oversee team’s day-to-day operations
 Drive technical solution design and system processes development
 Coordinate with business leaders and users to understand business requirements and implications 
Identify, escalate and manage production risks and issues to resolution
 Empower capability growth of direct reports and provide coaching and counseling as needed
 Motivate and inspire team for maximum performance
 Be part of a leading innovative, customer-centric and data-driven energy company

 Skills and Experience Required

 7+ years of data application design experience to drive end-to-end architecture and solution designs
 5+ years of experience in production support for mission-critical enterprise application
 5+ years hands-on experience with PL/SQL, database and data warehouse development
 5+ years of experience in data application design patterns, i.e., event-driven or layered service
 3+ years of solid experience in Python and Spark
 3+ years of hands-on experience with Amazon Web Services (AWS)
 2+ years of hands-on experience in Big Data or Apache Spark data platform, such as Databricks.
 Enterprise-level job experience, focusing on high volume, scalability, and reusability when architecting technical solutions
 Exceptional communication and interpersonal skills with an ability to extract, translate and communicate meaningful information at the executive, management, and peer levels
 Strong technical documentation skills, including workflows, architectural diagrams, and support documentation
 2+ years’ experience as a manager or team lead - leading, managing and delivering complex technology deliveries with resources in multiple locations
 Ability to orchestrate, lead, and influence virtual teams, ensuring successful implementation of customer projects
 Bachelor's Degree or equivalent professional experience

 Preferred

 Experience with Data Governance Tool, for example, Collibra
 Experience with unstructured data
 Programming experience with Unix/Shell scripting
 Experience with Amazon Lambda, Athena and Redshift
 Hands-on experience with Orchestration tools like Airflow or Step Function
 An advanced degree in the area of specialization is preferred
 Experience with Agile/Scrum methodologies
 Energy / Utility industry experience


 Why NRG is a great place to work:

 Great company culture!! Voted as a BEST employer by Forbes
 A competitive total compensation package, including annual incentive and/or commission
 Stock Purchase Plan
 Benefits on the first day of employment - Medical, Dental, Vision, Life Insurance, and Short Term Disability, Wellness program, etc.
 Company-paid life insurance and disability insurance
 401 (k) plan to help save for retirement
 Generous PTO plan, plus 8 company holidays, and 3 floating holidays
 Numerous discounts, including electricity discounts on NRG brands

 The salary range for this role is $99,000 - $144,000. Pay is based on several factors, including but not limited to education, work experience, certifications, etc.

 NRG Energy is committed to a drug and alcohol free workplace. To the extent permitted by law and any applicable collective bargaining agreement, employees are subject to periodic random drug testing, and post-accident and reasonable suspicion drug and alcohol testing. EOE AA M/F/Protected Veteran Status/Disability
 EEO is the Law Poster (The poster can be found at http://www.eeoc.gov/employers/upload/poster_screen_reader_optimized.pdf)
 Level, Title and/or Salary may be adjusted based on the applicant's experience or skills.
 Official description on file with Talent."
Sr Data Engineer (On-site),Shellpoint Mortgage Servicing,"Houston, TX",Posted 30+ days ago,Full-time,https://www.indeed.com/rc/clk?jk=8a7f91ce99254912&fccid=ee2d6fb81ddfc752&vjs=3,"Who we are
 

   Shellpoint Mortgage Servicing (SMS) is one of America’s top-five non-bank mortgage-servicing companies. What is mortgage servicing? Our clients are businesses that own mortgage loans (such as banks and real estate investment firms). On their behalf, we manage (or “service”) their loan portfolios, which means that we collect homeowners’ mortgage payments, pay their tax and insurance bills, and help homeowners in default to get current.
 



 Primary Function/Summary
  



    We are on a mission to evolve how we use data at Shellpoint to grow our business and fulfill the needs of our customers. We are modernizing our data and integration platform to be best in class. In this role you will be responsible for implementing modern architecture and engineering design patterns in a range of technologies, considering both technical and economic perspectives. You will partner with technical and business stakeholders to implement solutions balancing current and legacy technical standards, while keeping an eye towards scalability and resilience. We are looking for someone who can design, code, and execute in both cloud and on prem environments – while evangelizing the opportunities of good engineering design, modern integration architectures and data as a service.
  




    Direct Reports
  


 N/A




    Principal Duties
  


 Serve as a key contributor to identify, evaluate, and execute the development and implementation of data infrastructure.
 Deliver collaborative products that align with organization and decision strategies.
 Consult with technology and business staff to understand business need and provide thought leadership on solutions during requirements gathering sessions.
 Serve as key contributor in the development and maintenance of the data warehouse.
 Support critical strategic initiatives and architect moderately complex data engineering projects.
 Design and develop scalable, efficient data pipeline processes to handle data ingestion, cleansing, transformation, integration, and validation required to provide access to curated data sets to data analysts and data scientists.
 Develop, communicate, and present solution architectures to both technology and business stakeholders.
 Develop highly complex SQL queries to extract data for analysis and model construction.
 Design, build, and maintain internal and external data integrations.
 Build robust data pipelines, optimizing workloads across on prem and cloud environments.
 Test and validate data pipelines, transformations, datasets, reports, and dashboards built by team.
 Document and test data processes including performance of through data validation and verification.
 Contribute to delivery of multiple large, complex data engineering projects simultaneously.
 Collaborate with technology management to define standards and best practices for team.
 Mentor and assist other data engineers, data analytics and data scientists.
 Provide support to other data engineering, data analytics, application development, data systems and production support teams.
 Work on other projects as assigned.
 Performs related duties as assigned by supervisor.




    Core Development Stack
  


 Languages: SQL (standard and DB-specific)
 Tools/Products: Microsoft SQL Server, Snowflake, SSIS (SQL Server Integration Services), HVR/Fivetran, Snaplogic, SSRS (SQL Server Reporting Services), RedGate Developer Toolkit, Tableau, PowerBI
 Frameworks: Amazon Web Services (AWS) & Microsoft Azure cloud services
 Other: Azure DevOps, Smartsheet, Microsoft Visio, TFS (Team Foundation Server), Octopai




    Education and Experience Requirements
  


 College or university degree in the field of Information Technology, Data Science, Computer Science, MIS, or another STEM-related field required. Significant experience in a similar role or industry will be considered as a replacement.
 5-7 years engineering/development experience
 Expertise in SQL Server 2017 or higher
 Expertise with data and analytics technologies such as RDBMS, ETL and BI
 Experience with SQL Server Integration Services (SSIS)
 Experience with SQL Server Reporting Services (SSRS)
 Experience with Microsoft Visual Studio 2017 or higher
 Experience with on prem and cloud solution design and engineering
 Experience with Snowflake, Azure, AWS, or other cloud technologies


   Experience with agile delivery methodologies
 



    Knowledge, Skill, and Ability Requirements
  


 Cloud-based solution design and engineering
 Experience with tools such as HVR/Fivetran and Snaplogic are a plus
 Azure data and analytics deployments
 Experience in solution design spanning multiple frameworks
 Experience in other languages such as Python, R, Spark SQL, Java, etc. are a plus
 Experience with Azure DevOps, TFS
 Familiarity with API-first architectures
 Real time streaming data delivery
 DevOps and CI/CD experience
 Mortgage servicing, mortgage lending and/or finance experience



 While this description is intended to be an accurate reflection of the position’s requirements, it in no way implies/states that these are the only job 
responsibilities.
 Management reserves the right to modify, add or remove duties and request other duties, as necessary.



   Company Perks:
  

15 Paid Time Off (PTO) days and 18 after 1st anniversary!
9 Paid Holidays
Employee Engagement Activities



 Company Benefits:
  

Medical (including Health Savings Account & Flexible Savings Account)
Dental - RX – Vision – Life, Disability Insurance – 401(k) Plan with company match! – Employee Assistance Plan



 Performance-based Incentives
Pet Insurance
Advancement Opportunities



   Newrez NOW:
 

Our Corporate Social Responsibility program, Newrez NOW, empowers employees to become leaders in their communities through a robust program that includes volunteering, philanthropy, nonprofit grants, and more
1 Volunteer Time Off (VTO) day, company-paid volunteer day where all eligible employees may participate in a volunteer event with a nonprofit of their choice
Employee Matching Gifts Program: We will match monetary employee donations to eligible non-profit organizations, dollar-for-dollar, up to $1,000 per employee
Newrez Grants Program: Newrez hosts a giving portal where we provide employees an abundance of resources to search for an opportunity to donate their time or monetary contributions


 Equal Employment Opportunity
   We're proud to be an equal opportunity employer- and celebrate our employees' differences, including race, color, religion, sex, sexual orientation, gender identity, national origin, age, disability, and Veteran status. Different makes us better."
Data Platform Engineer,LyondellBasell Industries,"Hybrid remote in Houston, TX 77010",Posted 30+ days ago,,https://www.indeed.com/rc/clk?jk=7a9528566d45114f&fccid=5938580c9c7de4d3&vjs=3,"Location: Houston, TX, US, 77010 
    







     Req ID: 82614 
    







     Facility: One Houston Center-130 
    







     Department: Data Platform 
    







     Division: Innovation 
    








LyondellBasell



 Basic Function


 LyondellBasell has fully committed to achieving its vision as “The Chemical Company of the Future” and an industry leader in the areas of Sustainability and Customer Experience. The Digital Enterprise that will act as the foundation for enabling this vision will be built upon three pillars: A modern and extensible technology architecture, an ERP backbone that supports new business models, and a team of talented technologists that are empowered to build innovative solutions and digital products.


At the intersection of these pillars, the Data & Analytics Center of Excellence is building the data foundation and a catalog of data products, analytical applications, and enterprise services that give users across our company the tools, data, and guidance to generate insights.


The Data Platform Engineer is part of the team responsible for providing and supporting a modern, scalable and secure data platform for business intelligence, data science and analytics at scale.




 Roles & Responsibilities



Deployment, configuration, support and maintenance of cloud resources on the data platform to support data and analytics at scale and the delivery of data products and services.
Ensure availability, performance and scalability of the data platform.
Help drive automation of platform and self-service for data consumers.
Work with multiple teams both inside and outside the Data & Analytics CoE, such as the Data Engineers, Product teams, Enterprise Architecture team, Cyber Security etc. in implementing end-to-end solutions on the data platform.
Work with Cyber Security team to ensure data platform adheres to security standards.
Implement recommendations for performance, cost, compliance, security etc.
Contribute to the evaluation of new technologies, vendor products and services.
Implement data protection options, including HA and DR protection in Azure.
Configure monitoring and alerting for both availability and performance of the data platform.
Provide input to report on metrics associated with the performance and availability of data platform services and products.
Contribute to continuous improvements, practices, and operational efficiencies within the team.





Min. Qualifications



Bachelor’s degree in Computer Science, Information Systems, Engineering or equivalent experience in a relevant field
10+ years of relevant work experience in the IT industry
3+ years of experience designing, deploying and configuring Azure services.
3+ years of experience supporting cloud environments including IaaS and PaaS
3+ years of experience working with operating systems like UNIX, Linux and Windows server.
Hands on experience using the Azure administration portal and Azure CLI
Proficiency with PowerShell, Python or other scripting languages
Experience in writing SQL queries and Stored Procedures
Knowledge of the Microsoft Enterprise software products and services
Understanding of data flows, data architecture, ETL and processing of structured and unstructured data
Familiarity with database methodologies and various relational and NoSQL database technologies
Experience in resolving issues with Azure resources.
Knowledge of DevOps and Agile concepts & development principles including continuous integration & continuous delivery (CI/CD).
Ability to troubleshoot problems in a diverse and challenging environment





Preferred Qualifications



Microsoft Azure Cloud Platform certification - Administrator or Architect level
Hands on experience deploying and managing Microsoft Azure PaaS services, such as but not limited to Azure SQL, Azure Synapse, Azure Data Lake Store, Azure Data Factory and Azure Kubernetes Service (AKS)
Experience of Reporting and Analytics tools such as Power BI and Tableau
Experience with global enterprise environment or major consulting firm.
Familiarity with Agile and/or Scrum methods of delivery
Knowledge of enterprise ETL tools like Azure Data Factory, SSIS, Informatica or similar.
Experience with CI/CD tools (Git, Azure DevOps, Jenkins, TFS, Maven, Nexus…)
Data Management, Data Integration or Data Engineering experience.
Knowledge of at least one other cloud hosting solution in addition to Azure (e.g., Google, AWS)
Business Continuity or Disaster Recovery planning experience
Understanding of networking concepts (SSL configurations, vnets, nsg, subnets…)

#LI-SS1
#LI-Hybrid




 Competencies



         Builds effective teams
        

          Collaborates
        

          Cultivates innovation
        

          Customer focus
        

          Demonstrates courage
        

          Drives results
        

          Ensures accountability
        

          Instills trust and exemplifies integrity
        





We are LyondellBasell – a leader in the global chemical industry creating solutions for everyday sustainable living. Through advanced technology and focused investments, we are enabling a circular and low carbon economy. Across all we do, we aim to unlock value for our customers, investors and society. As one of the world’s largest producers of polymers and a leader in polyolefin technologies, we develop, manufacture and market high-quality and innovative products for applications ranging from sustainable transportation and food safety to clean water and quality healthcare. For more information, please visit www.lyondellbasell.com or follow @LyondellBasell on LinkedIn.


Must be at least 18 years of age and must be legally authorized to work in the United States (US) on a permanent basis without visa sponsorship.


LyondellBasell does not accept or retain unsolicited résumés or phone calls and/or respond to them or to any third party representing job seekers.


LyondellBasell is an equal opportunity employer. We evaluate qualified applicants without regard to race, color, religion, sex, sexual orientation, gender identity, national origin, disability, age, veteran status, and other protected characteristics. The US EEO is the Law poster is available here."
