job_title,company,job_location,post_date,salary,job_url,job_description
"Lead, Data Engineer",Bain & Company,"Houston, TX 77010 (Downtown area)",Posted 30+ days ago,"$157,500 - $189,500 a year",https://www.indeed.com/rc/clk?jk=62cdd6b0344b8b2e&fccid=48270b2eee62c2c6&vjs=3,"WHAT MAKES US A GREAT PLACE TO WORK 

 We are proud to be consistently recognized as one of the world's best places to work, a champion of diversity and a model of social responsibility. We are a Glassdoor Best Place to Work and we have maintained a spot in the top four since its founding in 2009. We believe that diversity, inclusion and collaboration are key to building extraordinary teams. We hire people with exceptional talents, abilities and potential, then create an environment where you can become the best version of yourself and thrive both professionally and personally. 

 WHO YOU’LL WORK WITH 

 Working alongside our generalist consultants, Bain's Advanced Analytics Group (AAG) helps clients across industries solve their biggest problems using our expertise in data science, customer insights, statistics, machine learning, data management, supply chain analytics and data engineering. Stationed in our global offices, AAG team members hold advanced degrees in computer science, engineering, AI, data science, physics, statistics, mathematics, and other quantitative disciplines, with backgrounds in a variety of fields including tech, data science, marketing analytics and academia. 

 WHAT YOU’LL DO 

 As a member of the growing Cloud, Apps and Data Engineering team in Bain’s Advanced Analytics Group, you will: 



Partner with Data Science, Machine Learning, and Platform Engineering teams to develop and deploy production quality code
Develop and champion modern Data Engineering concepts to technical audience and business stakeholders
Implement new and innovative deployment techniques, tooling, and infrastructure automation within Bain and our clients.
Travel is required (30%)
 ABOUT YOU 


Master’s degree in Computer Science, Engineering, or a related technical field.
3+ years at Senior or Staff level, or equivalent
3+ years of experience programming with Python, Scala, C/C++, Java, C#, Go, or similar programming language.
3+ years of experience with SQL or NoSQL databases: PostgreSQL, SQL Server, Oracle, MySQL, Redis, MongoDB, Elasticsearch, Hive, HBase, Teradata, Cassandra, Amazon Redshift, Snowflake.
Experience in deploying serverless data pipelines through containerization and terraform orchestration
Industry level experience of working with public cloud environments (AWS, GCP, or Azure), and associated deep understanding of failover, high-availability, and high scalability
Scaling and optimizing schema and performance tuning SQL and ETL pipelines in data lake and data warehouse environments.
Strong computer science fundamentals in data structures, algorithms, automated testing, object-oriented programming, performance complexity, and implications of computer architecture on software performance.
Data ingestion using one or more modern ETL compute and orchestration frameworks (e.g. Apache Airflow, Luigi, Spark, Apache Nifi, and Apache Beam).
Version control and git workflows
Strong interpersonal and communication skills, including the ability to explain and discuss complex mathematical and machine learning technicalities with colleagues and clients from other disciplines at their level of cognition
Curiosity, proactivity and critical thinking
 ABOUT US 

 Bain & Company is a global consultancy that helps the world’s most ambitious change makers define the future. 

 Across 64 cities in 39 countries, we work alongside our clients as one team with a shared ambition to achieve extraordinary results, outperform the competition, and redefine industries. We complement our tailored, integrated expertise with a vibrant ecosystem of digital innovators to deliver better, faster, and more enduring outcomes. Our 10-year commitment to invest more than $1 billion in pro bono services brings our talent, expertise, and insight to organizations tackling today’s urgent challenges in education, racial equity, social justice, economic development, and the environment. We earned a gold rating from EcoVadis, the leading platform for environmental, social, and ethical performance ratings for global supply chains, putting us in the top 2% of all companies. Since our founding in 1973, we have measured our success by the success of our clients, and we proudly maintain the highest level of client advocacy in the industry. 


U.S. Compensation and Benefit Information:
 Compensation for this role includes base salary, annual discretionary performance bonus, 401(k) plan with an annual employer contribution based on years of service and Bain’s best in class benefits package (details listed below). 

 Some local governments in the United States require a good-faith, reasonable salary range be included in job postings for open roles. The estimated annualized compensation for this role is as follows: 

 In New York City, the good-faith, reasonable annualized full-time salary range for this role is between $157,500 - $189,500; placement within this range will vary based on several factors including, but not limited to experience, education, licensure/certifications, training and skill level 

 In California state, the good-faith, reasonable annualized full-time salary range for this role is between $157,500- $189,500; placement within this range will vary based on several factors including, but not limited to experience, education, licensure/certifications, training and skill level 

 In Washington state, the good-faith, reasonable annualized full-time salary range for this role is between $157,500- $189,500; placement within this range will vary based on several factors including, but not limited to experience, education, licensure/certifications, training and skill level 

 For all other U.S. locations, the good-faith, reasonable annualized full-time salary range for this role is commensurate with competitive geographic market rates for this role and will vary based on several factors including, but not limited to experience, education, licensure/certifications, training and skill level 

 Annual discretionary performance bonus 

 This role may also be eligible for other elements of discretionary compensation 

 4.5% 401(k) company contribution, which increases after 3 years of service and is 100% vested upon start date 

 Bain & Company's comprehensive U.S. benefits and wellness program is designed to help employees achieve personal independence, protection and stability in the areas most important to you and your family."
Sr Data Engineer (On-site),Shellpoint Mortgage Servicing,"Houston, TX",Posted 30+ days ago,Full-time,https://www.indeed.com/rc/clk?jk=8a7f91ce99254912&fccid=ee2d6fb81ddfc752&vjs=3,"Who we are
 

   Shellpoint Mortgage Servicing (SMS) is one of America’s top-five non-bank mortgage-servicing companies. What is mortgage servicing? Our clients are businesses that own mortgage loans (such as banks and real estate investment firms). On their behalf, we manage (or “service”) their loan portfolios, which means that we collect homeowners’ mortgage payments, pay their tax and insurance bills, and help homeowners in default to get current.
 



 Primary Function/Summary
  



    We are on a mission to evolve how we use data at Shellpoint to grow our business and fulfill the needs of our customers. We are modernizing our data and integration platform to be best in class. In this role you will be responsible for implementing modern architecture and engineering design patterns in a range of technologies, considering both technical and economic perspectives. You will partner with technical and business stakeholders to implement solutions balancing current and legacy technical standards, while keeping an eye towards scalability and resilience. We are looking for someone who can design, code, and execute in both cloud and on prem environments – while evangelizing the opportunities of good engineering design, modern integration architectures and data as a service.
  




    Direct Reports
  


 N/A




    Principal Duties
  


 Serve as a key contributor to identify, evaluate, and execute the development and implementation of data infrastructure.
 Deliver collaborative products that align with organization and decision strategies.
 Consult with technology and business staff to understand business need and provide thought leadership on solutions during requirements gathering sessions.
 Serve as key contributor in the development and maintenance of the data warehouse.
 Support critical strategic initiatives and architect moderately complex data engineering projects.
 Design and develop scalable, efficient data pipeline processes to handle data ingestion, cleansing, transformation, integration, and validation required to provide access to curated data sets to data analysts and data scientists.
 Develop, communicate, and present solution architectures to both technology and business stakeholders.
 Develop highly complex SQL queries to extract data for analysis and model construction.
 Design, build, and maintain internal and external data integrations.
 Build robust data pipelines, optimizing workloads across on prem and cloud environments.
 Test and validate data pipelines, transformations, datasets, reports, and dashboards built by team.
 Document and test data processes including performance of through data validation and verification.
 Contribute to delivery of multiple large, complex data engineering projects simultaneously.
 Collaborate with technology management to define standards and best practices for team.
 Mentor and assist other data engineers, data analytics and data scientists.
 Provide support to other data engineering, data analytics, application development, data systems and production support teams.
 Work on other projects as assigned.
 Performs related duties as assigned by supervisor.




    Core Development Stack
  


 Languages: SQL (standard and DB-specific)
 Tools/Products: Microsoft SQL Server, Snowflake, SSIS (SQL Server Integration Services), HVR/Fivetran, Snaplogic, SSRS (SQL Server Reporting Services), RedGate Developer Toolkit, Tableau, PowerBI
 Frameworks: Amazon Web Services (AWS) & Microsoft Azure cloud services
 Other: Azure DevOps, Smartsheet, Microsoft Visio, TFS (Team Foundation Server), Octopai




    Education and Experience Requirements
  


 College or university degree in the field of Information Technology, Data Science, Computer Science, MIS, or another STEM-related field required. Significant experience in a similar role or industry will be considered as a replacement.
 5-7 years engineering/development experience
 Expertise in SQL Server 2017 or higher
 Expertise with data and analytics technologies such as RDBMS, ETL and BI
 Experience with SQL Server Integration Services (SSIS)
 Experience with SQL Server Reporting Services (SSRS)
 Experience with Microsoft Visual Studio 2017 or higher
 Experience with on prem and cloud solution design and engineering
 Experience with Snowflake, Azure, AWS, or other cloud technologies


   Experience with agile delivery methodologies
 



    Knowledge, Skill, and Ability Requirements
  


 Cloud-based solution design and engineering
 Experience with tools such as HVR/Fivetran and Snaplogic are a plus
 Azure data and analytics deployments
 Experience in solution design spanning multiple frameworks
 Experience in other languages such as Python, R, Spark SQL, Java, etc. are a plus
 Experience with Azure DevOps, TFS
 Familiarity with API-first architectures
 Real time streaming data delivery
 DevOps and CI/CD experience
 Mortgage servicing, mortgage lending and/or finance experience



 While this description is intended to be an accurate reflection of the position’s requirements, it in no way implies/states that these are the only job 
responsibilities.
 Management reserves the right to modify, add or remove duties and request other duties, as necessary.



   Company Perks:
  

15 Paid Time Off (PTO) days and 18 after 1st anniversary!
9 Paid Holidays
Employee Engagement Activities



 Company Benefits:
  

Medical (including Health Savings Account & Flexible Savings Account)
Dental - RX – Vision – Life, Disability Insurance – 401(k) Plan with company match! – Employee Assistance Plan



 Performance-based Incentives
Pet Insurance
Advancement Opportunities



   Newrez NOW:
 

Our Corporate Social Responsibility program, Newrez NOW, empowers employees to become leaders in their communities through a robust program that includes volunteering, philanthropy, nonprofit grants, and more
1 Volunteer Time Off (VTO) day, company-paid volunteer day where all eligible employees may participate in a volunteer event with a nonprofit of their choice
Employee Matching Gifts Program: We will match monetary employee donations to eligible non-profit organizations, dollar-for-dollar, up to $1,000 per employee
Newrez Grants Program: Newrez hosts a giving portal where we provide employees an abundance of resources to search for an opportunity to donate their time or monetary contributions


 Equal Employment Opportunity
   We're proud to be an equal opportunity employer- and celebrate our employees' differences, including race, color, religion, sex, sexual orientation, gender identity, national origin, age, disability, and Veteran status. Different makes us better."
Data Platform Engineer,LyondellBasell Industries,"Hybrid remote in Houston, TX 77010",Posted 30+ days ago,,https://www.indeed.com/rc/clk?jk=7a9528566d45114f&fccid=5938580c9c7de4d3&vjs=3,"Location: Houston, TX, US, 77010 
    







     Req ID: 82614 
    







     Facility: One Houston Center-130 
    







     Department: Data Platform 
    







     Division: Innovation 
    








LyondellBasell



 Basic Function


 LyondellBasell has fully committed to achieving its vision as “The Chemical Company of the Future” and an industry leader in the areas of Sustainability and Customer Experience. The Digital Enterprise that will act as the foundation for enabling this vision will be built upon three pillars: A modern and extensible technology architecture, an ERP backbone that supports new business models, and a team of talented technologists that are empowered to build innovative solutions and digital products.


At the intersection of these pillars, the Data & Analytics Center of Excellence is building the data foundation and a catalog of data products, analytical applications, and enterprise services that give users across our company the tools, data, and guidance to generate insights.


The Data Platform Engineer is part of the team responsible for providing and supporting a modern, scalable and secure data platform for business intelligence, data science and analytics at scale.




 Roles & Responsibilities



Deployment, configuration, support and maintenance of cloud resources on the data platform to support data and analytics at scale and the delivery of data products and services.
Ensure availability, performance and scalability of the data platform.
Help drive automation of platform and self-service for data consumers.
Work with multiple teams both inside and outside the Data & Analytics CoE, such as the Data Engineers, Product teams, Enterprise Architecture team, Cyber Security etc. in implementing end-to-end solutions on the data platform.
Work with Cyber Security team to ensure data platform adheres to security standards.
Implement recommendations for performance, cost, compliance, security etc.
Contribute to the evaluation of new technologies, vendor products and services.
Implement data protection options, including HA and DR protection in Azure.
Configure monitoring and alerting for both availability and performance of the data platform.
Provide input to report on metrics associated with the performance and availability of data platform services and products.
Contribute to continuous improvements, practices, and operational efficiencies within the team.





Min. Qualifications



Bachelor’s degree in Computer Science, Information Systems, Engineering or equivalent experience in a relevant field
10+ years of relevant work experience in the IT industry
3+ years of experience designing, deploying and configuring Azure services.
3+ years of experience supporting cloud environments including IaaS and PaaS
3+ years of experience working with operating systems like UNIX, Linux and Windows server.
Hands on experience using the Azure administration portal and Azure CLI
Proficiency with PowerShell, Python or other scripting languages
Experience in writing SQL queries and Stored Procedures
Knowledge of the Microsoft Enterprise software products and services
Understanding of data flows, data architecture, ETL and processing of structured and unstructured data
Familiarity with database methodologies and various relational and NoSQL database technologies
Experience in resolving issues with Azure resources.
Knowledge of DevOps and Agile concepts & development principles including continuous integration & continuous delivery (CI/CD).
Ability to troubleshoot problems in a diverse and challenging environment





Preferred Qualifications



Microsoft Azure Cloud Platform certification - Administrator or Architect level
Hands on experience deploying and managing Microsoft Azure PaaS services, such as but not limited to Azure SQL, Azure Synapse, Azure Data Lake Store, Azure Data Factory and Azure Kubernetes Service (AKS)
Experience of Reporting and Analytics tools such as Power BI and Tableau
Experience with global enterprise environment or major consulting firm.
Familiarity with Agile and/or Scrum methods of delivery
Knowledge of enterprise ETL tools like Azure Data Factory, SSIS, Informatica or similar.
Experience with CI/CD tools (Git, Azure DevOps, Jenkins, TFS, Maven, Nexus…)
Data Management, Data Integration or Data Engineering experience.
Knowledge of at least one other cloud hosting solution in addition to Azure (e.g., Google, AWS)
Business Continuity or Disaster Recovery planning experience
Understanding of networking concepts (SSL configurations, vnets, nsg, subnets…)

#LI-SS1
#LI-Hybrid




 Competencies



         Builds effective teams
        

          Collaborates
        

          Cultivates innovation
        

          Customer focus
        

          Demonstrates courage
        

          Drives results
        

          Ensures accountability
        

          Instills trust and exemplifies integrity
        





We are LyondellBasell – a leader in the global chemical industry creating solutions for everyday sustainable living. Through advanced technology and focused investments, we are enabling a circular and low carbon economy. Across all we do, we aim to unlock value for our customers, investors and society. As one of the world’s largest producers of polymers and a leader in polyolefin technologies, we develop, manufacture and market high-quality and innovative products for applications ranging from sustainable transportation and food safety to clean water and quality healthcare. For more information, please visit www.lyondellbasell.com or follow @LyondellBasell on LinkedIn.


Must be at least 18 years of age and must be legally authorized to work in the United States (US) on a permanent basis without visa sponsorship.


LyondellBasell does not accept or retain unsolicited résumés or phone calls and/or respond to them or to any third party representing job seekers.


LyondellBasell is an equal opportunity employer. We evaluate qualified applicants without regard to race, color, religion, sex, sexual orientation, gender identity, national origin, disability, age, veteran status, and other protected characteristics. The US EEO is the Law poster is available here."
Data Engineer Senior Consultant (Clearance Required),Deloitte,"Houston, TX",Posted 30+ days ago,Full-time,https://www.indeed.com/rc/clk?jk=544a9838fb67c0c7&fccid=9e215d88a6b33622&vjs=3,"In this age of disruption, organizations need to navigate the future with confidence by tapping into the power of data analytics, robotics, and cognitive technologies such as Artificial Intelligence (AI). Our Strategy & Analytics portfolio helps clients leverage rigorous analytical capabilities and a pragmatic mindset to solve the most complex of problems. By joining our team, you will play a key role in helping to our clients uncover hidden relationships from vast troves of data and transforming the Government and Public Services marketplace.
 

Work you'll do

 The Data Engineer will design future-state, modern data architecture for transformation at the enterprise level using advanced architectural principles. Using tools such as Snowflake and/or Databricks, they will also work with cutting-edge DevOps technologies, develop advanced analytics products, and apply data and statistical programming tools to enterprise data to advance and enable key mission outcomes within environments (GCP, AWS, Azure).
 

The team 

 Deloitte's Government and Public Services (GPS) practice - our people, ideas, technology and outcomes-is designed for impact. Serving federal, state, & local government clients as well as public higher education institutions, our team of over 15,000+ professionals brings fresh perspective to help clients anticipate disruption, reimagine the possible, and fulfill their mission promise.
 
 The GPS AI & Data Engineering offering is responsible for developing advanced analytics products and applying data visualization and statistical programming tools to enterprise data in order to advance and enable the key mission outcomes for our clients. Our team supports all phases of analytic work product development, from the identification of key business questions through data collection and ETL, and from performing analyses and using a wide range of statistical, machine learning, and applied mathematical techniques to delivery insights to decision-makers. Our practitioners give special attention to the interplay between data and the business processes that produce it and the decision-makers that consume insights.
 
 Qualifications
 
 Required:
 


Minimum Active Top Secret Level Security Clearance



5+ years of professional experience in data engineering (SQL).



5+ years of experience designing and developing real time ETL architecture for real time predictive analytics.



5+ years of experience with Databricks, Snowflake, or AWS



Bachelor's degree in Computer Science, Engineering, Mathematics or other business-related field

 Preferred:
 


3+ years of relevant consulting or industry experience



Creativity and innovation - desire to learn and apply new technologies, products, and libraries



Prior professional services or federal consulting experience

 How you'll grow
 
 At Deloitte, our professional development plan focuses on helping people at every level of their career to identify and use their strengths to do their best work every day. From entry-level employees to senior leaders, we believe there's always room to learn. We offer opportunities to help sharpen skills in addition to hands-on experience in the global, fast-changing business world. From on-the-job learning experiences to formal development programs, our professionals have a variety of opportunities to continue to grow throughout their career.
 
 The wage range for this role takes into account the wide range of factors that are considered in making compensation decisions including but not limited to skill sets; experience and training; licensure and certifications; and other business and organizational needs. The disclosed range estimate has not been adjusted for the applicable geographic differential associated with the location at which the position may be filled. At Deloitte, it is not typical for an individual to be hired at or near the top of the range for their role and compensation decisions are dependent on the facts and circumstances of each case. A reasonable estimate of the current range is $97,000 to $181,000
 
 #LI-JRK"
