job_title,company,job_location,post_date,salary,job_url,job_description
Data Center Applications Engineer,Toshiba International Corporation,"Hybrid remote in Houston, TX 77041",EmployerActive 10 days ago,Full-time,https://www.indeed.com/pagead/clk?mo=r&ad=-6NYlbfkN0ChbgYjWcif22hw4nRPBa9ZpaWXN2YxPMimdtIolzSdeG3K5hthPdZ9-Dk26gWUOFtp6Jyjm1HeGjMcXx62CdnZlOCNme8dcKuBrATIu5QXphTSu9U-xcgIUWY91JQfCVSs2LLbQoT8RkAdJZZq1wm41z93vT7DfJAqmUVv5ZoIKCPgK2VC3n6azOTgOsBAFv5NjRi0-JtcZBMkDeI7BPKHP_I_ig_9InBZASyCk-w_xYrKCORfFDInBTDR7tvMtD4x2ZDSBtLmqMQjxNBFX3l7pC-9qaX-mZRQmBtjGEXdHEAfprfAkrtleKHyYWtRPW-spN-9QH6Xo92KNZFmUEMkEH-O5sOXIRkPR-l8DALPirmCzz9UZwIzu86_VtlBxJvW9qWz2Hqly4G2aElMN7hFZ0mn1NmDq3BamWXl7HtHLToWa57UVGL1bZUIBna4jbXrrNkhJNL0G3_xeZXmTZToDMQg-krvMG7a0rhSuDWA-LKjLDSfyIzOEcJzw30WYxzevzYDBl-ailbnOKYvYwUGbhzA8oqjk_gNru5KmLqShW4h7EGeW8dMvK-qQTv3j1WfhN66Nudps4haIbokgEaF&xkcb=SoB3-_M3MLz6rT3-5x0HbzkdCdPP&p=12&fvj=1&vjs=3,"Toshiba International Corporation is a world leader in the design and manufacture of motors, motor controls and power electronics products. Many of these products are designed, built and tested in our 1,000,000 square foot state-of-the-art manufacturing facility in Houston, TX. We have developed a totally integrated manufacturing process from research and development, design, engineering, production and manufacturing to after-market service and sales & marketing. Toshiba differentiates itself from its competitors through its commitment to quality and reliability. We build products to perform in the most difficult conditions. From raw material to the finished product, we assure exacting quality, engineering excellence and stringent testing to meet domestic and international performance standards.
Job Summary:
The Data Center Application Engineer uses technical knowledge along with interpersonal skills to understand Data Center customer`s issues and propose solutions. Data Center Engineer may participate in all facets of the business cycle including; inputs on new product designs, review of Data Center one lines and applications, quoting, forecasting, preparing technical literature, presenting product features and benefits, solving technical issues.
Responsibilities:

Assist Product Managers and the UPS sales department with Data Center product support including technical presentations, proper application of our products, review of customer engineering specifications, preparation of quotations, and obtaining answers to questions at all stages of negotiation, production, and after shipment activities.
Possesses extensive knowledge of the Data Center product lines, industry standards (i.e. UL, CE, NEMA, IEEE, etc.)
Possesses extensive knowledge of the application of Toshiba`s and competitors product offerings in complex Data Center systems.
Provides technical guidance and mentorship to more junior engineering team members.
Develops and reviews product literature such as manuals, brochures, application notes, success stories, Technical Document papers, etc.
Possesses an extensive knowledge of Toshiba Data Center complimentary products.
Creates test specifications / test plans for Data Center products.
Capable of testing assigned Data Center products and competitor`s products in the laboratory environment for their performance characteristics. Interface with internal and external
Design Engineers for the design and development of existing and new Data Center products, author and technically review new product specifications, as well as resolving technical problems on supplied products.
Interface with internal and external manufacturing regarding customer orders.
Communicate with sales force and customers and serve as a key contributor in Data Center sales activities.
Train sales force and customers independently and in-group settings.
Complete additional projects as assigned by management.
Comply with all Toshiba policies, procedures and link company objectives to assigned activities.
Provides leadership to ensure group adherence to policies, procedures and company objectives.
Responsible for preparing competitive analysis.
Employee needs to be aware and maintain profitability through orders and quotes.
This position may be responsible for sign off/review of quotes, according to Toshiba s policy.
Travel: 25% to 50%

Educational Requirements:

An engineering degree in electrical engineering (BSEE or MSEE).

Experience Requirements:

At least 4 years' experience in data center infrastructure over 1MW, including UPS, design, and operations.

Job Type: Full-time
Schedule:

8 hour shift

Work Location: Hybrid remote in Houston, TX 77041"
Software Data Engineer,HP,"Spring, TX 77389",Posted 30+ days ago,Full-time,https://www.indeed.com/rc/clk?jk=d2b744775bd134ff&fccid=1b866506aec22461&vjs=3,"Applies advanced subject matter knowledge to solve complex business issues and is regarded as a subject matter expert. Frequently contributes to the development of new ideas and methods. Works on complex problems where analysis of situations or data requires an in-depth evaluation of multiple factors. Leads and/or provides expertise to functional project teams and may participate in cross-functional initiatives. Acts as an expert providing direction and guidance to process improvements and establishing policies. Frequently represents the organization to external customers/clients. Exercises significant independent judgment within broadly defined policies and practices to determine best method for accomplishing work and achieving objectives. May provide mentoring and guidance to lower level employees.

 Responsibilities

 Leads one or more project teams of other data engineers for all stages of design and development for complex, secure and performant data solutions and models, including design, analysis, coding, testing, and integration of structured/unstructured data.
 Builds and manages relationships throughout the organization
 Reviews and evaluates designs and project activities for compliance with architecture, security and quality guidelines and standards; provides tangible feedback to improve product quality and mitigate failure risk.
 Provides domain-specific expertise and overall data systems leadership and perspective to cross-organization projects, programs, and activities.
 Drives innovation and integration of new technologies into projects and activities in the big data space.
 Collaborates and communicates with project team regarding project progress and issue resolution.
 Represents the data engineering team for all phases of larger and more-complex development projects.
 Provides guidance and mentoring to less experienced staff members.


 Knowledge & Skills

 Extensive experience with data engineering tools, languages, frameworks to mine, cleanse and explore data.
 Excellent analytical and problem-solving skills.
 Fluent in NoSQL & relational based systems.
 Strong experience in overall architecture of big data systems, cloud services/systems.
 Designing data systems/solutions to manage complex data in complex, distributed and massively parallel systems.
 Evaluating forms and processes for database architecture testing and methodology, including writing and execution of test plans, debugging, and testing scripts and tools.
 Excellent written and verbal communication skills; mastery in English and local language.


 Ability to effectively communicate product architectures, design proposals and negotiate options at senior management levels.
 Extensive experience with working with the multiple BI platforms (Thoughtspot, PowerBI, Tableau, etc.)
 Minimum 5+ years of experience in data integration and data integrity concepts
 Experience in data integrations with SAP using tools like Odata services/ SLT/API


 Ability to and aptitude with extracting data out of SAP
 Expertise in defining an overall solution and technical architecture, design solutions involving application development, data integration between SAP systems and non-SAP systems, between On-premises SAP and on-cloud applications
 Knowledge on various SAP data structures/models and integration framework
 Knowledge on SAP CPI
 Knowledge in sustainability areas is a plus


 Scope & Impact

 Collaborates with peers, junior engineers, data scientists and project team.
 Typically interacts with high- level Individual Contributors, Managers, Directors and Program Core Teams.
 Leads multiple projects requiring data engineering solutions development.
 Drives design innovation.


 Education & Experience

 Bachelor's or Master's degree in Computer Science, Information Systems, Engineering, or equivalent.
 Typically 6-10 years’ experience.


 About HP





  You’re out to reimagine and reinvent what’s possible—in your career as well as the world around you.
 

   So are we. We love taking on tough challenges, disrupting the status quo, and creating what’s next. We’re in search of talented people who are inspired by big challenges, driven to learn and grow, and dedicated to making a meaningful difference.
 



   HP is a technology company that operates in more than 170 countries around the world united in creating technology that makes life better for everyone, everywhere.
 



   Our history: HP’s commitment to diversity, equity and inclusion – it's just who we are.
 

   From the boardroom to factory floor, we create a culture where everyone is respected and where people can be themselves, while being a part of something bigger than themselves. We celebrate the notion that you can belong at HP and bring your authentic self to work each and every day. When you do that, you’re more innovative and that helps grow our bottom line. Come to HP and thrive!"
Data Engineer,CAPCO,"Houston, TX",Posted 20 days ago,,https://www.indeed.com/rc/clk?jk=31f52de76214beb6&fccid=c2a63affe8751868&vjs=3,"About the team:
 Capco’s Data Team helps our clients transform every aspect of their business. We are highly skilled at formulating data strategy, defining business and technology initiatives across the data management lifecycle, and aligning multi-year strategic roadmaps with client’s business goals. As digital technologies advance and regulations tighten, today’s consumers – and, therefore, today’s businesses – are becoming more aware of the importance of good quality data. We work to establish holistic ways to effectively manage data through the modern data supply chain and facilitate consumption through analytics, modelling, AI, machine learning, dashboarding, and reporting.
 About the Job:
 As a member of our Data Team, you will work across Capco’s different domains and solution offerings to help break down large problems, develop approaches and solutions. As a Data Engineer, you will create analytics reporting and provide data-driven strategic insights, trends, and perspective to help drive transformation for our clients.
 What You’ll Get to Do:

Work on hard problems with smart people.
Be highly motivated, result-oriented, and take pride in being a problem solver.
Work with new technology, focus on using the right tool for the job, rather than any sticky preference for a tool or technology.
Linux system administration, development and production environments.
Learn and share knowledge across our engineering teams, so we can continue to iterate and improve.
Write reusable, testable, and efficient code as needed.
Design and implement of low-latency, high-availability, and performant database systems.
Work on implementation of data pipelines/data warehouses/data marts/ODSs/Lakehouses.
Collaborate and work on integration of data storage solutions.
Cloud, container and microservices infrastructures.
Software security.
Focus on performance tuning, improvement, balancing, usability and automation.

What You’ll Bring with You:

Data Analysis – Intermediate to expert level with algorithms and complexity analysis.
Data Engineering -using Microsoft Azure cloud and on prem Spark/Hadoop Development.
Data Engineering Foundation – Certification nice to have, theory and practice.
Real-time event processing.
Proficient in Azure technologies such as: Azure Data Factory (ADF), Azure Data Bricks (ADB), Azure Active Directory, Azure Storage, Azure data Lake Services (ADLS), Azure key vault, Azure SQL DB, Azure HDInsight and OR AWS.
VBA, Python, PowerBi, Excel.
Functional programming.
Data Engineering using Microsoft Azure cloud and on prem Spark/Hadoop Development
Experience in Energy Trading and/or experience in the competitive Gas and Power markets a plus.

Why Capco?
 A career at Capco is a chance to help reshape the competitive landscape in financial services. We launch new banks, transform existing ones, and help our clients navigate complex change. As consultants, we work on the front-end business design all the way through to technology implementation.
 We are the largest Financial Services focused consultancy in the world, serving everyone from global banks to emerging FinTechs, from strategy through digital transformation, design, business consulting, data and analytics, cyber, cloud, technology architecture, and engineering.
 Capco is a young and growing firm. We maintain an entrepreneurial spirit and growth mindset and have minimal bureaucracy. We have no internal silos that get in the way of your career opportunities or ability to focus on our clients and make a difference to the business. We offer the opportunity for everyone to learn rapidly, take on tough challenges, and get promoted quickly. We take pride in our creative, collaborative, diverse, and inclusive culture, where everyone can #BYAW.
 We offer highly competitive benefits, including medical, dental and vision insurance, a 401(k) plan, tuition reimbursement, and a work culture focused on innovation and creation of lasting value for our clients and employees.
 Ready to take the Next Step
 If this sounds like you, we would love to hear from you. This is an opportunity to make a difference and contribute to a highly successful company with a significant growth trajectory."
Data Integrity Engineer - Aveva PI,Meta,"Remote in Houston, TX 77001",,,https://www.indeed.com/rc/clk?jk=f75d235d2f2e9fb4&fccid=d314ad972cb806dc&vjs=3,N/A
Senior Data Engineer,"Vorys, Sater, Seymour and Pease LLP.","Houston, TX 77010 (Downtown area)",,Full-time,https://www.indeed.com/rc/clk?jk=11708fcadce2d364&fccid=1278a7bab1639d00&vjs=3,"Precision eControl is an Ancillary Business of Vorys, Sater, Seymour and Pease LLP.
 
Precision eControl is all about helping brands better manage their eCommerce presence on Amazon and other online marketplaces. As a Senior Data Engineer, you will be part of a team that creates innovative, cutting edge, one of a kind solutions that are revolutionizing how brands manage online marketplace sales.
 Position Summary
 The Senior Data Engineer for the Azure infrastructure will be responsible for the day to day operations of a large data warehouse, and will work closely with the business, product team, and the technical staff to ensure alignment to goals and objectives. Utilizing experience with Big Data, this position will drive consensus on designs of stable, reliable and effective dynamic ETL pipelines leveraging Azure Synapse Analytics Pipelines. At this time, candidates who would work in the following states will not be considered for this role: VT, RI, NY, NJ, NH, MI, ME, MA, DE, CO, CT, CA, and AZ.
 Essential Job Functions

 Drive consensus on designs of stable, reliable and effective dynamic ETL pipelines leveraging Azure Synapse Analytics Pipelines.
 Perform root cause analysis on internal and external data and processes to answer specific business questions and identify opportunities for improvement.
 Design, implement, and document data load processes from disparate data sources into Azure Synapse Pipelines.
 Work with Continuous Integration/Delivery using Azure DevOps and Github.
 Provide data management, monitoring, troubleshooting and support to client success
 Create various triggers to automate the pipeline in Azure Synapse Analytics Pipelines.
 Tune SQL queries in Azure SQL DB, Azure Synapse and solve complex data challenges and deliver insights that help our customers achieve their goals.
 Self-organize as part of a small-size scrum team and apply data engineering skills.
 Follows industry best practices and meets company’s security and performance and requirements

 Knowledge, Skills and Abilities

 Minimum three (3) years’ experience with MS SQL/T-SQL
 Minimum three (3) years’ experience with Azure SQL
 Minimum three (3) years’ experience with Apache Spark (PySpark)
 Minimum of three (3) years’ experience with Azure Data Factory or Azure Synapse building dynamic ETL pipelines
 Minimum three (3) years' experience building dynamic Spark notebooks in Azure Synapse Spark or Azure Databricks
 Minimum three (3) years’ experience with Python
 Minimum two (2) years’ experience with a public cloud (AWS, Microsoft Azure, Google Cloud)
 Experience working with parquet, json , delta, avro and csv files
 In-depth understanding of data management (e.g. permissions, recovery, security and monitoring)
 Experience with Data Warehouse Architecture
 Strong analytic skills related to working with structured, semi-structured and unstructured datasets.
 Excellent analytical and organization skills required
 Ability to understand user requirements
 Client service mindset
 Excellent verbal and written communication skills
 Excellent problem solving skills
 Familiarity with Agile frameworks a plus

 Education and Experience

 Bachelor's degree in related discipline or combination of equivalent education and experience
 7-10 years of experience in similar field

 Precision eControl LLC does not discriminate in hiring or terms and conditions of employment because of an individual’s sex, race, age, religion, national origin, ancestry, color, sexual orientation, gender identity, genetic information, marital status, military/veteran status, disability or any other characteristic protected by local, state or federal law. Precision eControl only hires individuals authorized for employment in the United States."
Big Data Engineer - PySpark,Logic20/20 Inc.,"Houston, TX",,"$130,000 - $155,000 a year",https://www.indeed.com/rc/clk?jk=7f7b1f6f3668d307&fccid=2e9e942085461a66&vjs=3,N/A
Data Security Engineer - Corporate - US,Sysco,"Houston, TX",,Full-time,https://www.indeed.com/rc/clk?jk=c3d43f2ceada2c1e&fccid=053befe8409ab9e4&vjs=3,N/A
Senior Data Engineer,Business Intelli Solutions Inc,"Houston, TX",,"From $130,000 a year",https://www.indeed.com/company/Business-Intelli-Solutions-inc/jobs/Data-Engineer-a70fee14e91e98c7?fccid=7c90bc2e3e871d56&vjs=3,N/A
Sr. Data Engineer,mBridge Solutions,"Houston, TX",,Contract,https://www.indeed.com/rc/clk?jk=37dcdbed1192af5c&fccid=2605c7c80b4a846c&vjs=3,"mbridge is seeking an experienced Data engineer for a leading Oil and Gas client in Houston, TX.
  





Job Title: Senior Data Engineer 



Contract: 12 months plus 



Location: Houston, TX 





  N 
  ote: Only Houston, TX candidates 




Responsibilities: 


Build analytics tools that utilize the data pipeline to provide actionable insights into customer acquisition, operational efficiency and other key business performance metrics. 


Work with stakeholders including the Executive, Product, Data and Design teams to assist with data-related technical issues and support their data infrastructure needs. 


Create data tools for analytics and data scientist team members that assist them in 


Create and maintain optimal data pipeline architecture, Assemble large, complex data sets that meet functional / non-functional business requirements. 


Work with data and analytics experts to strive for greater functionality in our data systems. 


Identify, design, and implement internal process improvements: automating manual processes, optimizing data delivery, re-designing infrastructure for greater scalability, etc. 


Build the infrastructure required for optimal extraction, transformation, and loading of data from a wide variety of data sources using SQL and other technologies. 


  building and optimizing our product into an innovative industry leader.
  






Requirements 

Required Qualifications: 



Minimum 10+ years of experience 


Analytics/data product solution architecture on Azure (Azure Data Factory, Databricks) 


Data extract, load and transformation techniques and tools including orchestration of needed azure resources 


Azure analytics services 


Programming, scripting (Python, SQL, Scala) 


Analytics data frameworks (Spark etc.) 


Data architecture concepts understanding (relational and dimensional data models) 


Information security 


Software engineering tools and methodologies (e.g. Agile, ADO, Ansible, GIT)"
Data Performance Engineer,National Oilwell Varco,"Hybrid remote in Houston, TX 77086",,"$82,632 - $101,557 a year",https://www.indeed.com/company/NOV/jobs/Performance-Engineer-f7c3a7d81c58e847?fccid=0059806ce5dabd16&vjs=3,"19332 - View NOV careers webpage for more opportunities at www.nov.com/careers/.
Responsibilities:

Analyze drilling and equipment data to measure operational performance of NOV Drilling Automation systems to support the Performance Center and its customers.
Use data visualization tools to monitor, develop performance reports and assist team members to maintain top performance at the operational level.
Proactively provide insights and detailed analysis to our customers and establish Key Performance Indicator (KPI) goals to maintain drilling efficiencies and automation performance.
Review and validate data received from the customer’s drilling automation systems.
Analyze and interpret drilling data to determine operating performance metrics and identify areas for improvement with equipment tuning, maintenance and Automation usage.
Attend customer operation planning sessions to discuss and determine KPI targets for well sections.
Create detailed Performance Reports utilizing data visualization tools and provide analysis on current drilling and equipment operation metrics.
Drive action recommendations based on analytics and communicate to management.
Perform data profiling to identify and understand anomalies.
Implement new data analysis methodologies.
Identify and communicate opportunities for Performance Center improvement based on data analysis and customer feedback.
Assist the Performance Center teams in providing insight for troubleshooting, utilization of automated systems and recommendations for data technology improvements.

Qualifications:

Bachelor’s degree in engineering.
5 or more years’ experience in O&G or drilling operations preferred.
Location: 5100 N Sam Houston Pkwy West, Houston TX. 77086.
Hybrid work schedule (3 days in the office and 2 days remote work) once training is completed.
Ability to travel internationally.
Proficiency with MS Visio, Excel, PowerPoint, Project, Teams, SharePoint a plus.
Proficiency with JIRA and Confluence software a plus.
Proficiency with Amphion and/or Cyberbase Controls preferred.
Proficiency with NOVOS, MMC, and/or other Automation products preferred.
Proficiency with Business Intelligence tools (Power BI, Tableau, Grafana) preferred.
Thorough knowledge of Drilling Fundamentals and Equipment required.
Experience with Drilling Controls (Amphion, Cyberbase) or similar a plus.
Proficiency in Automation Systems (NOVOS, MMC, etc.) or similar a plus.
Comfortable with figures and collecting, studying, and interpreting data.
Ability to compile, configure, and present data in a concise manner.
Skilled in creating and manipulating Excel spreadsheets. Knowledge of SQL or basic programming a big plus
Experience transforming data into reports, dashboards, and KPIs

NOV Rig Technologies makes and supports the world’s most advanced drilling solutions. To learn more about Rig Technologies products and services, please visit us at https://www.nov.com/about/our-company-structure/rig.
Job Type: Full-time
Pay: $82,631.78 - $101,556.55 per year
Benefits:

401(k)
401(k) matching
Dental insurance
Employee assistance program
Employee discount
Flexible spending account
Health insurance
Health savings account
Life insurance
Paid time off
Referral program
Retirement plan
Vision insurance

Compensation package:

Bonus pay

Experience level:

10 years
5 years
6 years
7 years
8 years
9 years

Schedule:

8 hour shift

Ability to commute/relocate:

Houston, TX 77086: Reliably commute or planning to relocate before starting work (Required)

Experience:

offshore drilling or monitoring rig equipment: 5 years (Required)
analyzing drilling and equipment data work: 5 years (Required)
data visualization tools to monitor performance reports work: 5 years (Required)

Work Location: Hybrid remote in Houston, TX 77086"
